id,site_name,site_address,comments,tags,type,
TD000, 大波池 Dapo Pond,台灣 池上鄉大坡山下,38 則評論,自然與公園 水域,site,
TD001, 綠島鄉 Green Island,台灣 臺東市 台東以東33公里,355 則評論,自然與公園 島嶼,site,
TD002, 池上環圳自行車道 Chishang Huanzhen Bicycle Path,台灣 池上鄉,20 則評論,戶外活動 自然與公園 單車專用道,site,
TD003, 台東森林公園 Taitung Forest Park,台灣 臺東市 台東市華泰路300號 950,561 則評論,自然與公園,site,
TD004, 玉富自行車道 Yufu Bike Path,台灣 玉里鎮玉里車站前康樂街,10 則評論,戶外活動 自然與公園 單車專用道,site,
TD005, 綠島小長城 Green Island Little Great Wall,台灣 綠島鄉,10 則評論,景點與地標 景點和地標,site,
TD006, 多良火車站 Duoliang Station,台灣 瀧溪路8-1號 多良村 963,124 則評論,景點與地標 景點和地標 觀景台和觀景塔,site,
TD007, 金樽漁港 Chintsun Fish Harbor,台灣 東河鄉冬河村,3 則評論,景點與地標 景點和地標,site,
TD008, 臺灣國際熱氣球嘉年華 Taiwan International Balloon Fiesta,台灣 台東鹿野高台,118 則評論,活動 文化活動,site,
TD009, 綠島石朗 Lvdaoshilang,台灣 綠島鄉環島公路17公里處路旁,15 則評論,自然與公園 戶外活動,site,
TD010, 三仙台風景區 Sanxiantai,台灣 成功鎮東北,390 則評論,自然與公園 島嶼 水域,site,
TD011, 台東伯朗大道 Taitung Brown's Road,台灣 池上鄉錦新2號,523 則評論,景點與地標 景點和地標,site,
TD012, 鹿野高台 Lu Yeh High Land,台灣 鹿野鄉永安村高台路42巷145號,290 則評論,景點與地標 農場 瞭望台,site,
TD013, 杉原-富山復魚區 Shayuan - Fushan Fish Reserve,台灣 卑南鄉富山村杉原24號,48 則評論,自然與公園 水域,site,
TD014, 知本溫泉 Zhibenwenquan,台灣 台東市西南17公里,44 則評論,自然與公園 溫泉和間歇泉,site,
TD015, 國立臺灣史前文化博物館 National Museum of Prehistory,台灣 臺東市 台東市博物館路1號,129 則評論,博物館 歷史博物館,site,
TD016, 鐵花村 Tiehuacun,台灣 臺東市 新生路135巷26號,341 則評論,,site,
TD017, 關山環鎮自行車道 Guanshan Bicycle Path,台灣 關山鎮新福里隆盛路1號,32 則評論,戶外活動 自然與公園 單車專用道,site,
TD018, 蘭嶼 Orchid Island（Lanyu）,台灣,138 則評論,自然與公園 島嶼,site,
TD019, 哈巴狗 Habagou Island,台灣 綠島鄉環島公路8公里處,9 則評論,自然與公園 地質構造,site,
TD020, 池上鄉農會四季花海 Chishang Town Nong Hui Si Ji Hua Hai,台灣 池上鄉新興村七鄰85-6號 958,3 則評論,自然與公園 景點與地標,site,
TD021, 金崙溫泉 Jinlun Hot Spring,台灣 太麻里鄉金崙村,12 則評論,自然與公園 溫泉和間歇泉,site,
TD022, 台東山海鐵馬道 Old Railway Bikeway,台灣 台東市,9 則評論,自然與公園 戶外活動 單車專用道,site,
TD023, 月光小棧 Moonlight Inn,台灣 東河鄉都蘭村420號之8 959,27 則評論,景點與地標 景點和地標,site,
TD024, 鹽水溫泉 Salt Water Hot Springs,台灣 綠島鄉八田路,10 則評論,自然與公園 溫泉和間歇泉,site,
TD025, 金剛大道 Jin Gang Da Dao,台灣 長光產業道路 962,9 則評論,景點與地標 戶外活動 自駕觀景遊,site,
TD026, 綠島燈塔 Green Island Lighthouse,台灣 綠島西北角 951,49 則評論,景點與地標 燈塔,site,
TD027, 青山農場 Cing Shan Farm,台灣 太麻里太麻里大王村佳崙42號,2 則評論,景點與地標 農場,site,
TD028, 綠島 Lv Dao,台灣,18 則評論,自然與公園 島嶼,site,
TD029, 富山漁業資源保育區 Fushan Fisheries Conservation Area,台灣 卑南鄉富山村13鄰杉原58-1號,4 則評論,自然與公園 其他自然景觀與公園 水域,site,
TD030, 栗松溫泉 Li Song Hot Spring,台灣 海端鄉摩天部落,22 則評論,自然與公園 溫泉和間歇泉,site,
TD031, 綠島露營區 Lvdao Camping Area,台灣 綠島鄉溫泉路256號,2 則評論,自然與公園 珊瑚礁 地質構造,site,
TD032, 東部海岸國家風景區 East Coast National Scenic Area,台灣 成功鎮,84 則評論,戶外活動 自然與公園 登山步道,site,
TD033, 布農文教基金會布農部落園區 Bunongwen Park,台灣 延平鄉桃源村11鄰昇平路191號,2 則評論,博物館 特色博物館,site,
TD034, 台東客家文化園區 Taitung Hakka Culture Area,台灣 池上鄉新興村新光路1號,1 則評論,景點與地標 景點和地標,site,
TD035, 過山古道 Historic Mountail Trail,台灣 綠島鄉,2 則評論,自然與公園 戶外活動 登山步道,site,
TD036, 水往上流 Water Running Up,台灣 東河鄉,72 則評論,自然與公園 地質構造 水域,site,
TD037, 二層坪水橋 Er Ceng Ping Shui Bridge,台灣 坪頂路 鹿野鄉 955,9 則評論,景點與地標 橋樑 景點和地標,site,
TD038, 知本 Chihpen,台灣 卑南鄉,26 則評論,自然與公園 溫泉和間歇泉,site,
TD039, 台東加路蘭海岸 Taitung Jialulan Coast,台灣 臺東市 海端鄉,88 則評論,景點與地標 景點和地標,site,
TD040, 綠島大白沙 Green Island Dabai Beach,台灣 綠島鄉,4 則評論,自然與公園 戶外活動 海灘,site,
TD041, 三仙台 Nuwalian,台灣 成功鎮三仙里基翬路,57 則評論,自然與公園 戶外活動,site,
TD042, 東河橋 Tungho Bridge,台灣 東河鄉東河村,12 則評論,景點與地標 橋樑,site,
TD043, 櫻木平交道 Sakura Ki Road,台灣 太麻里鄉,10 則評論,景點與地標 景點和地標,site,
TD044, 大武山生態教育館 Dawushan Ecocenter,台灣 太麻里鄉金崙村溫泉35-2號 963,1 則評論,景點與地標 教育景點,site,
TD045, 小野柳 Xiouyeliu,台灣 臺東市 富岡碼頭北方,106 則評論,自然與公園,site,
TD046, 觀音洞 Kuanin Cave,台灣 綠島,5 則評論,自然與公園 大洞穴和洞窟,site,
TD047, 南寮漁港 Nanliao Port,台灣 綠島,6 則評論,景點與地標 碼頭和木板人行道,site,
TD048, 南寮街 Nan Liao Street,台灣 綠島鄉,5 則評論,景點與地標 景點和地標,site,
TD049, 台東海濱公園 Taitung Seashore Park,台灣 台東市大同路底,92 則評論,自然與公園,site,
TD050, 龍鳳佛堂 Long Feng Fo Tang Temple,台灣 鯉魚山之上 950,1 則評論,景點與地標 宗教聖地,site,
TD051, 太麻里金針山 Taimali Kinchen Mountain,台灣 太麻里鄉大王村金針山,49 則評論,自然與公園 山脈,site,
TD052, 阿底旦文化故事館 Adidan Cultural Museum,台灣 太麻里鄉多良村2鄰15號 963,1 則評論,博物館 特色博物館,site,
TD053, 月光小棧 Yueguan Xiaozhan,台灣 成功鎮都蘭村46鄰20號 950,2 則評論,景點與地標 瞭望台,site,
TD054, 大白沙海灘 Tapaisha Beach,台灣 綠島,1 則評論,自然與公園 戶外活動 海灘,site,
TD055, 台東鐵道藝術村 Taitung Railway Art Village,台灣 臺東市 台東市鐵花路371號,173 則評論,博物館 藝術博物館,site,
TD056, 台東知本忠義堂 Taitung Chihben Jhongyi Temple,台灣 卑南鄉溫泉路,5 則評論,景點與地標 景點和地標,site,
TD057, 都蘭灣 Dulan Bay,台灣,2 則評論,自然與公園 水域,site,
TD058, 青青草原 Cing Cing Grass,台灣 蘭嶼鄉 952,20 則評論,景點與地標 景觀徒步區,site,
TD059, 帆船鼻大草原 Fanchuanbi Grass,台灣 綠島鄉溫泉路167號,11 則評論,景點與地標 景觀徒步區,site,
TD060, 鹽寮 Yanliao,台灣 壽豐鄉鹽寮村 974,1 則評論,自然與公園 戶外活動,site,
TD061, 綠島馬蹄橋 Green Island Mati Bridge,台灣 綠島鄉,5 則評論,景點與地標 景點和地標 橋樑,site,
TD062, 池上藝術村 Art Chishang,台灣 池上鄉中西三路6號 958,8 則評論,博物館 購物,site,
TD063, 鹿野龍田自行車道 Luye Longtian Bikeway District,台灣 鹿野鄉龍田村,22 則評論,戶外活動 自然與公園 單車專用道,site,
TD064, 萬安磚窯廠 Wan-an Brick Kiln,台灣 池上鄉萬安村1鄰1-1號 958,1 則評論,景點與地標 古蹟,site,
TD065, 柚子湖 Youzih Lake,台灣 綠島鄉,10 則評論,自然與公園 水域,site,
TD066, 綠島朝日溫泉 Green Island Chaorih Hot Spring,台灣 綠島鄉溫泉167號,57 則評論,自然與公園 溫泉和間歇泉,site,
TD067, 知本森林遊樂區 Chihben Forest Recreation,台灣 卑南鄉溫泉村龍泉路290號,29 則評論,自然與公園 自然和野生動物區,site,
TD068, 鸞山森林博物館 Luan Shan Forest Museum,台灣 延平鄉鸞山部落 953,16 則評論,博物館 自然歷史博物館,site,
TD069, 布農部落 Bunun Leisure Farm,台灣 延平鄉桃源村11鄰昇平路191號 953,5 則評論,自然與公園,site,
TD070, 三和海濱公園 Sanhe Coast Park,台灣 太麻里? 963,2 則評論,自然與公園,site,
TD071, 大鳥遊憩區 Da Niao You Qi Qu,台灣 大鳥村南迴公路 965,1 則評論,景點與地標 景點和地標,site,
TD072, King Annona Squamosa,台灣 57 Outer Ring Road, Tai Wo Village, Taimali,site,購物 飲食 農貿市場
TD073, 天后宮 Tianhou Temple,台灣 台東市中華路2巷1號 956,24 則評論,景點與地標 宗教聖地,site,
TD074, 初鹿牧場 Chu Lu Ranch,台灣 卑南鄉明峰村28鄰牧場1號 954,130 則評論,景點與地標 農場,site,
TD075, 綠島楠仔湖 Green Island Nanzai Lake,台灣 綠島鄉東部,1 則評論,自然與公園 水域,site,
TD076, 火雞岩 Huo Ji Yan,台灣 Lvdao Township 綠島鄉,1 則評論,自然與公園 地質構造,site,
TD077, 綠島人權文化園區 Green Island Human Rights Memorial Park,台灣 綠島鄉將軍岩20號,27 則評論,景點與地標 景點和地標,site,
TD078, 池上浮圳環線自行車道 Chihshang Fuzunhuansian Bikeway,台灣 池上鄉,1 則評論,戶外活動 自然與公園 單車專用道,site,
TD079, 小野柳 Xiaoyeliu,台灣 臺東市 No.500 Section 1, Songjiang Rd, 松江路一段500號,site,戶外活動 自然與公園
TD080, 嘉明湖 Jiaming Lake,台灣 海端鄉,21 則評論,自然與公園 水域,site,
TD081, 綠島南寮漁港 Green Island Nanliao Fish Harbor,台灣 綠島鄉6-1號,1 則評論,景點與地標 景點和地標,site,
TD082, 都蘭遺址 Dulan Site,台灣 東河鄉都蘭村圓山產業道路 95941,21 則評論,景點與地標 古蹟,site,
TD083, 新元昌紅茶產業文化館 Xinyuanchang Red Tea Cultural Center,台灣 鹿野鄉永安村永安路451號 955,3 則評論,博物館 特色博物館,site,
TD084, 小黃山 Siao Huang Shan,台灣 卑南鄉,4 則評論,景點與地標 景點和地標,site,
TD085, 利吉惡地 Liji Badlands,台灣 卑南鄉利吉村,13 則評論,景點與地標 瞭望台,site,
TD086, 山里火車站 Shanli Station,台灣 卑南鄉嘉豐村山里路108號 954,8 則評論,景點與地標 景點和地標,site,
TD087, 南??路紀念公園 Nanhuitielu Memorial Park,台灣 岩灣路101巷 950,1 則評論,自然與公園,site,
TD088, 加路蘭遊憩區 Jialulan Recreation Area,台灣 臺東市 臺東市富岡漁港,28 則評論,景點與地標 景點和地標,site,
TD089, 台東觀光夜市 Taitung Tourism Night Market,台灣 臺東市 台東市正氣路,87 則評論,購物 跳蚤市場和街頭市集,site,
TD090, 千禧曙光紀念園區 Millennium Dawn Memorial Park,台灣 南匯路35號 963,1 則評論,景點與地標 自然與公園 景點和地標,site,
TD091, 都蘭紅糖文化園區 Dulan Sugar Factory Cultural Park,台灣 東河鄉都蘭村61號,26 則評論,景點與地標 自然與公園 景點和地標,site,
TD092, 登仙橋遊憩區 Deng Xian Bridge Recreation Area,台灣 959,4 則評論,景點與地標 景觀徒步區,site,
TD093, 東河玉皇殿 Donghe Yu Huang Temple,台灣 東河村353號 959,1 則評論,景點與地標 宗教聖地,site,
TD094, 山地人祖先發祥地碑 Shan Di Ren Zu Xian Da Xiang Di Bei,台灣 三和村及華源村交界處公路邊,1 則評論,景點與地標 古代遺址 古蹟,site,
TD095, 烏石鼻 Wushibi,台灣 長濱鄉,5 則評論,戶外活動 景點與地標 自然與公園,site,
TD096, 台東環市自行車道 Taitung Bicycle Road,台灣 山海鐵馬道,25 則評論,自然與公園 戶外活動 單車專用道,site,
TD097, ?橋休息區 Chiehchiao Rest Area,台灣 961,2 則評論,景點與地標 景點和地標 瞭望台,site,
TD098, 台東原生應用植物園 Taitung Yuan Sheng Botanic Garden,台灣 卑南鄉明峰村試驗場8號,9 則評論,自然與公園 花園,site,
TD099, 海濱公園 Seaside Park,台灣 臺東市 台東市大同路,35 則評論,自然與公園,site,
TD100, 台東延平鄉蝴蝶谷 Taitung Yanping Butterfly Valley,台灣 延平鄉桃源村,4 則評論,自然與公園 山谷,site,
TD101, 卑南大圳公園 Beinan Dazun Park,台灣 卑南鄉,2 則評論,自然與公園,site,
TD102, 卑南文化公園 Beinan Wenhua Park,台灣 臺東市 文化公園路200號,58 則評論,自然與公園 博物館 歷史博物館,site,
TD103, 池上飯包博物館 Chihshang Fanbao Museum,台灣 池上鄉忠孝路259號,118 則評論,博物館 特色博物館,site,
TD104, 琵琶湖 Pipa Lake,台灣 臺東市 台東市台東森林公園,26 則評論,自然與公園 水域,site,
TD105, 白玉瀑布 Baiyu Waterfall,台灣 太麻里鄉,8 則評論,自然與公園 瀑布,site,
TD106, 卑南溪 Beinan River,台灣 鹿野鄉瑞隆村瑞景路一段23巷15號,1 則評論,自然與公園 水域,site,
TD107, 綠島牛頭山 Green Island Nioutoushan,台灣 綠島鄉,5 則評論,景點與地標 景點和地標,site,
TD108, 比西里岸幾米園區 Pisilian,台灣 臺東市 成功鎮三仙里白蓮路,15 則評論,景點與地標 景點和地標 景觀徒步區,site,
TD109, 稻米原鄉館 Rice Village House,台灣 池上鄉萬安村1鄰1-12號 958,3 則評論,博物館 特色博物館,site,
TD110, 台東美術館 Taitung Museum,台灣 臺東市 台東市浙江路350號,10 則評論,博物館 特色博物館,site,
TD111, 靈岩洞 Lingyan Cave,台灣 長濱鄉北段海灣,2 則評論,自然與公園 大洞穴和洞窟,site,
TD112, 燕子洞 Swallow Cave,台灣 達仁鄉,1 則評論,自然與公園 大洞穴和洞窟,site,
TD113, 知本樂山步道 Chihben Leshan Trail,台灣 卑南鄉溫泉村龍泉路,2 則評論,自然與公園 戶外活動 登山步道,site,
TD114, 鯉魚山公園 Liyushan Park,台灣 臺東市 台東市城西,44 則評論,自然與公園,site,
TD115, 新港漁市場(新港漁港,成功漁港) Xingang Fishing Market,台灣 成功鎮港邊路19號,10 則評論,site,
TD116, 東清灣 Dongcing Bay,台灣 蘭嶼鄉環島公路,7 則評論,景點與地標 景點和地標,site,
TD117, 綠島大街 Green Island Street,台灣 綠島鄉南寮村,7 則評論,景點與地標 景點和地標,site,
TD118, 池上斷層 Chihshang Fault,台灣 慶豐87號 大坡國小 958,1 則評論,景點與地標 景觀徒步區 景點和地標,site,
TD119, 富源觀景台 Fuyuan Guan Jing Tai,台灣,1 則評論,景點與地標 景點和地標,site,
TD120, 八仙洞 Baxian Cave,台灣 長濱鄉,32 則評論,自然與公園 大洞穴和洞窟,site,
TD121, 藍洞 Blue Cave,台灣 環島公路 951,2 則評論,景點與地標 景點和地標,site,
TD122, 公東高工教堂 Church of Kung-Tung,台灣 臺東市 中興路一段560號 950,6 則評論,景點與地標 教堂和大教堂,site,
TD123, 賓朗四格山 Binlang Sihgeshan,台灣 卑南鄉,2 則評論,景點與地標 景點和地標,site,
TD124, 四維夜市 Siwei Market,台灣 臺東市 台東市四維路,14 則評論,購物 跳蚤市場和街頭市集,site,
TD125, 關山親山農園 Guanshan Cin Shan Farm,台灣 關山鎮中華路23號,1 則評論,景點與地標 農場,site,
TD126, 舊樟原橋遊憩區 Old Zhangyuan Bridge,台灣 長濱鄉三間村,1 則評論,景點與地標 橋樑 古蹟,site,
TD127, 金城武樹 Jinchengwu Tree (Takeshi Kaneshiro Tree),台灣 伯朗大道 958,5 則評論,景點與地標 戶外活動,site,
TD128, 黑森林公園琵琶湖 Black Forest Park Pipa Lake,台灣 臺東市 台東市中山路,13 則評論,自然與公園 森林,site,
TD129, 都蘭山步道 Dulan Mountain Trail,台灣 東河鄉,3 則評論,自然與公園 戶外活動 登山步道,site,
TD130, 睡美人岩 Sleeping Beauty Rock,台灣 環島公路約8公里處 951,7 則評論,景點與地標 景點和地標,site,
TD131, 阿美族民俗中心 Ami Indigenous Culture Art Center,台灣 成功鎮信義里新村路25號,11 則評論,景點與地標 景點和地標,site,
TD132, 賴馬繪本館 Laima Picture Book Art Gallery,台灣 臺東市 台東市開封街680巷 950,5 則評論,博物館 購物 美術館,site,
TD133, 石雨傘風景區 Shihysan Scenic Area,台灣 成功鎮 961,8 則評論,景點與地標 自然與公園 戶外活動,site,
TD134, 天空之鏡 Tian Gong Zhi Jing,台灣 都歷傳統海域沙灘,3 則評論,自然與公園 戶外活動 海灘,site,
TD135, 象鼻岩 Xiang Bi Yan,台灣 綠島鄉,4 則評論,自然與公園 地質構造,site,
TD136, 台灣家樂福(台東店) Carrefour - Taitung Store,台灣 臺東市 正氣路300之1號 950,11 則評論,購物 購物中心,site,
TD137, 野銀部落地下屋 Yeyin Buluo Dixia Houses,台灣 環島公路 蘭嶼鄉 952,6 則評論,景點與地標 建築物 景點和地標,site,
TD138, 寒舍茶坊 Hanshe Tea House,台灣 卑南鄉頂岩灣1-9號,None,景點與地標 景點和地標,site,
TD139, 將軍岩 General Rock,台灣 綠島鄉公館村,7 則評論,自然與公園 地質構造,site,
TD140, 長濱樟原教會 Changbin Jhangyuan Church,台灣 長濱鄉長濱村140號,3 則評論,景點與地標 教堂和大教堂,site,
TD141, 關山環保親水公園 Guanshan Waterfront Park,台灣 關山鎮隆盛路1號 956,7 則評論,自然與公園,site,
TD142, 臺東糖廠文化創意園區 Taitung Tangchang Cultural Area,台灣 臺東市 中興路二段191號 950,12 則評論,博物館 特色博物館,site,
TD143, 綠島觀海步道 Lu Dao Guan Hai Bu Dao,台灣 環島公路 951,3 則評論,自然與公園,site,
TD144, 三叉山 Sancha Mountain,台灣 海端鄉,2 則評論,自然與公園 山脈,site,
TD145, 海蔘坪 Haishenping,台灣 綠島鄉,3 則評論,景點與地標 瞭望台,site,
TD146, 關山天后宮 Guanshan Tianhou Temple,台灣 關山鎮中華路2巷1號,1 則評論,景點與地標 景點和地標,site,
TD147, 清覺寺 Cing Jiao Temple,台灣 卑南鄉溫泉村龍泉路113巷21號,4 則評論,景點與地標 景點和地標,site,
TD148, 大坡池 Dapo Pond,台灣 池富道路23號 958,1 則評論,自然與公園 其他自然景觀與公園,site,
TD149, Taitung Ocean Mountain Bikeway,台灣 臺東市 No. 37 Tiehua Road,9 則評論,戶外活動 自然與公園 單車專用道,site,
TD150, 卡片教堂 Card Church,台灣 成功鎮宜灣路11號,9 則評論,景點與地標 教堂和大教堂,site,
TD151, 富岡碼頭 Fugang Pier,台灣 臺東市 台東市富岡街297號,21 則評論,景點與地標 景點和地標 碼頭和木板人行道,site,
TD152, 海端鄉布農族文物館 Haiduan Bunun Tribe Folk Museum,台灣 海端鄉海端村山平56號,2 則評論,博物館 藝術博物館,site,
TD153, 長光梯田 Changguang Terraced Fields,台灣 成功鎮長光社區,2 則評論,戶外活動 景點與地標,site,
TD154, 寶町藝文中心 Baoding Yiwen Center,台灣 臺東市 中山路184號 950,11 則評論,博物館 藝術博物館,site,
TD155, 六口溫泉 Liou Kou Hot Spring,台灣 海端鄉霧鹿南橫公路,2 則評論,自然與公園 溫泉和間歇泉,site,
TD156, 台東兒童故事館 Taitung Children's Story House,台灣 臺東市 台東市大同路103號,18 則評論,博物館 兒童博物館,site,
TD157, 池上鄉農會休閒米廠 Chihshang Farmers' Association Rice Factory,台灣 臺東市 池上鄉中山路302號,5 則評論,景點與地標 景點和地標,site,
TD158, 台東鐵道藝術村261倉庫 Taitung Railway Art Village 261 Warehouse,台灣 臺東市 台東市鐵花路269-297號 950,7 則評論,景點與地標 景點和地標,site,
TD159, 長濱自行車道 Changbin Bikeway,台灣 臺東市 長濱鄉,5 則評論,自然與公園 戶外活動 單車專用道,site,
TD160, 綠島蠟像館 Green Island Wax Museum,台灣 綠島鄉公館村將軍岩20號,5 則評論,博物館 特色博物館,site,
TD161, 臺東縣自然史教育館 Taitung Museum of Natural History,台灣 基翬路16號 No.16, Jihui Rd 961,2 則評論,site,
TD162, 孔子岩 Confucius Rock,台灣 ????泉? 溫泉區 951,4 則評論,景點與地標 自然與公園,site,
TD163, 台東東海龍門天聖宮 Taitung Donghai Longmen Tian Sheng Gong,台灣 臺東市 臺東市中華路一段889巷63-1號 95047,2 則評論,景點與地標 建築物 景點和地標,site,
TD164, 卑南遺址 Beinan Ruins,台灣 臺東市 文化公園路200號 950,8 則評論,景點與地標 景點和地標 古蹟,site,
TD165, 台東縣體育場 Taitung Stadium,台灣 臺東市 台東市桂林北路52巷120號,12 則評論,自然與公園,site,
TD166, 觀音洞 Guanyindong,台灣 綠島鄉公館村環島公路,3 則評論,自然與公園 景點與地標,site,
TD167, 台東縣旅遊服務中心 Taitung County Tourism Service Center,台灣 臺東市 鐵花路369號 950,5 則評論,旅客資源 遊客中心,site,
TD168, 鯉魚山 Carp Mountain,台灣 臺東市 台東市新生路,6 則評論,自然與公園 山脈,site,
TD169, 武安宮 Wu'an Temple,台灣 臺東市 台東市博愛路498巷16號,6 則評論,景點與地標 宗教聖地,site,
TD170, 野銀冷泉 Yeyin Cold Spring,台灣 蘭嶼鄉野銀村,5 則評論,景點與地標 景點和地標,site,
TD171, 成功教堂 Chenggong Church,台灣 大同路1-6號 961,2 則評論,景點與地標 教堂和大教堂 景點和地標,site,
TD172, 台東紅葉少棒紀念館 Taitung Red Leaf Baseball Team Memorial Hall,台灣 延平鄉紅葉村紅谷路1號,4 則評論,景點與地標 景點和地標,site,
TD173, 大相框 - 台東?海公園 Da Xiang Kuang - Taitung Seashore Park,台灣 臺東市 台東市大同路底,10 則評論,景點與地標 景點和地標,site,
TD174, 成功故事館 Chenggong Story House,台灣 成功鎮中山東路75號 961,1 則評論,博物館 特色博物館,site,
TD175, 秋芳工作室 Qiu Fang Gong Zuo Shi,台灣 臺東市 吉泰路43巷18號 954,1 則評論,景點與地標 景點和地標,site,
TD176, 轉角遇見 ART Zhuanjiao Yujian ART,台灣 臺東市 更生路43巷 950,1 則評論,景點與地標 景點和地標 景觀徒步區,site,
TD177, 海山寺 Haishan Temple,台灣 臺東市 中正路88號 950,3 則評論,景點與地標 宗教聖地,site,
TD178, 嘉明湖步道 Chiaming Lake Bu Dao,台灣,1 則評論,景點與地標 景點和地標 景觀徒步區,site,
TD179, 小丑魚主題館 Aquarium of Anemonefish,台灣 成功鎮港邊路21號,6 則評論,動物園和水族館 自然與公園,site,
TD180, 國立臺東生活美學館 Taitung Living Arts Center,台灣 臺東市 臺東市大同路254號 950,2 則評論,博物館 特色博物館,site,
TD181, 朝天宮 Chao Tian Gong,台灣 臺東市 台東市北平街26號 950,1 則評論,景點與地標 建築物,site,
TD182, 濟公堂 Jigongtang,台灣 臺東市 台東市精誠路133號之6,2 則評論,景點與地標 宗教聖地,site,
TD183, 北極殿 Beiji Temple,台灣 臺東市 台東市精誠路190號,4 則評論,景點與地標 宗教聖地,site,
TD184, 臺東藝文中心 Taitung Arts and Culture Center,台灣 臺東市 南京路25號 950,1 則評論,博物館 景點與地標 購物,site,
TD185, 佛光山日光寺 Fo Guang Shan Ri Guang Temple,台灣 臺東市 蘭州街58巷25號 950,2 則評論,景點與地標 宗教聖地,site,
TD186, 獨樹依織工作室 Unique Tapa,台灣 臺東市 岩灣路50巷467弄22號 950,1 則評論,景點與地標 景點和地標,site,
TD187, 豐里橋 Fengli Bridge,台灣 臺東市 台東市中華路 950,1 則評論,景點與地標 橋樑,site,
TD188, 臺東縣忠烈祠 Taitung Zhonglie Ci,台灣 臺東市 鯉魚山上,5 則評論,景點與地標 建築物,site,
TD189, 蘭嶼燈塔 Lanyu Lighthouse,台灣 蘭嶼鄉,5 則評論,景點與地標 景點和地標 燈塔,site,
TD190, 趣臺東 Qu tai dong,台灣 臺東市 鐵花路350號 950,1 則評論,景點與地標 景觀徒步區,site,
TD191, 石朗潛水區 Shilang Qianshui Qu,台灣 臺東市 南寮港口,1 則評論,自然與公園 戶外活動,site,
TD192, 仁愛福?宮 Ren Ai Fudegong,台灣 臺東市 台東市中華路1段200號,2 則評論,景點與地標 宗教聖地,site,
TD193, 關山警察局博物館 Guanshan Police Office Museum,台灣 臺東市 關山鎮中福里中正路27號,1 則評論,博物館 特色博物館,site,
TD194, 八仙洞遊客中心 Baxiandong Visitor Center,台灣 臺東市 長濱鄉,1 則評論,旅客資源 遊客中心,site,
TD195, 福安宮 Fu An Gong,台灣 臺東市 精誠路151巷22號,2 則評論,景點與地標 宗教聖地,site,
TD196, 大原花布燈籠生活文化館 Dayuan Huabudenglong Cultural Centers,台灣 臺東市 鹿野鄉瑞源村同興路156號,1 則評論,博物館 特色博物館,site,
TD197, 五孔洞 Wukong Cave,台灣 蘭嶼鄉,4 則評論,自然與公園 大洞穴和洞窟,site,
TD198, 台東鯉魚山公園 Taitung Carp Moutain Park,台灣 臺東市 台東市博愛路,3 則評論,自然與公園,site,
TD199, 台東表演藝術館 Taitung Performing Arts,台灣 臺東市 開封街671號2樓 950,1 則評論,博物館 藝術博物館,site,
TD200, 男人石 Nanrenshi,台灣 臺東市 成功鎮石傘路,1 則評論,景點與地標 景點和地標 宗教聖地,site,
TD201, 忠合宮 Zhonghegong,台灣 臺東市 台東市精誠路261號,2 則評論,景點與地標 宗教聖地,site,
TD202, 台東火車站 游客服務中心 Taidong Huoche Zhan Youke Fu Wu Zhongxin,台灣 臺東市 岩灣路101巷598號 950,3 則評論,旅客資源 遊客中心,site,
TD203, 人權紀念公園 Human Rights Culture Park,台灣 綠島鄉公館港口與將軍岩之間 952,5 則評論,自然與公園,site,
