id,site_name,site_address,comments,tags,type,
TD204, 台東棒球村 Taidong Country Baseball Village,台灣 臺東市 興安路一段525號,1 則評論,休閒與娛樂 體育館,site,
TD205, 脫線牧場 Tuoxian Leisure Farm,台灣 臺東市 鹿野鄉中華路一段100號,None,景點與地標 農場,site,
TD206, 馬蘭車站 Malan Station,台灣 臺東市 東糖街91號 950,1 則評論,景點與地標 景點和地標,site,
TD207, 蘭嶼五孔岩 Lanyu Wukongyan,台灣 蘭嶼鄉,5 則評論,景點與地標 景點和地標,site,
TD208, 情人洞 Lover Cave,台灣 蘭嶼鄉東清灣附近,2 則評論,自然與公園 大洞穴和洞窟,site,
TD209, 大天池 Datianchih,台灣 蘭嶼鄉紅頭村大森山原始森林中,1 則評論,自然與公園 水域,site,
TD210, 朗島灣 Langdao Bay,台灣 蘭嶼鄉朗島村,4 則評論,景點與地標 景點和地標,site,
TD211, 軍艦岩 Ji JaRawed,台灣 蘭嶼鄉 952,2 則評論,自然與公園 地質構造,site,
TD212, 雙獅岩 Lion Couple Rock,台灣 蘭嶼鄉東清到朗島之間的海濱,2 則評論,自然與公園 地質構造,site,
TD213, 蘭嶼八代灣 Lanyu Badai Bay,台灣 蘭嶼鄉蘭嶼機場附近,1 則評論,戶外活動 自然與公園 海灘,site,
TD214, 蘭嶼開元港 Lanyu Kaiyuan Port,台灣 蘭嶼鄉,3 則評論,景點與地標 景點和地標,site,
TD215, 小天池 Siao Tian Chih,台灣 蘭嶼鄉蘭嶼島,1 則評論,景點與地標 瞭望台,site,
TD216, 蘭嶼母雞岩 Lanyu Mujiyan,台灣 蘭嶼鄉,2 則評論,景點與地標 景點和地標,site,
TD217, 小蘭嶼 Jimagaod,台灣 蘭嶼鄉 952,1 則評論,自然與公園 地質構造 島嶼,site,
TD218, 蘭嶼祈禱山 Lanyu Cidaoshan,台灣 蘭嶼鄉環島公路,1 則評論,景點與地標 景點和地標,site,
TD219, 蘭嶼飛魚文化館 Lanyu Feiyu Cultural Center,台灣 蘭嶼鄉紅頭村漁人147號,1 則評論,博物館 特色博物館,site,
TD220, 龍頭岩 Longtouyan,台灣 蘭嶼鄉,2 則評論,景點與地標 瞭望台,site,
TD221, 饅頭岩 Mantou Rock,台灣 蘭嶼鄉椰油村 952,1 則評論,自然與公園 地質構造,site,
TD222, 蘭嶼坦克岩 Lanyu Tankeyan,台灣 蘭嶼鄉,1 則評論,景點與地標 景點和地標,site,
TD223, 蘭嶼象鼻岩 Lanyu Siangbiyan,台灣 蘭嶼鄉環島公路,2 則評論,景點與地標 景點和地標,site,
TD224, 鱷魚岩 Ji-macingeh,台灣 蘭嶼鄉 952,2 則評論,自然與公園 地質構造,site,
TD225, 玉女岩 Ji-mitazizik,台灣 蘭嶼鄉 952,1 則評論,自然與公園 地質構造,site,
TD226, 蘭嶼老人岩 Lanyu Laorenyan,台灣 蘭嶼鄉,1 則評論,景點與地標 景點和地標,site,
TD227, 太陽很多 A Lot of Sun,台灣 臺東市 知本路四段 950,None,景點與地標 農場,site,
TD228, 希巨蘇飛 Siki Sufin,台灣 臺東市 都蘭村63號 950,None,博物館 購物 美術館,site,
TD229, 臺東縣成功鎮原住民文物館 Taitung Xian Chenggong Zhen Yuan Zhu Min Wen Wu Guan,台灣 民富路43號 961,None,博物館 歷史博物館,site,
TD230, 天真聖門維合道院 Tian Zhen Sheng Men Wei He Dao Yuan,台灣 東河鄉隆昌村9-1號 959,None,景點與地標 宗教聖地 景點和地標,site,
TD231, 日光大橋 Riguang Bridge,台灣 臺東市 台?市,None,景點與地標 橋樑,site,
TD232, 太平溪 Taiping Xi,台灣 卑南?,None,自然與公園 水域,site,
TD233, 台東霍爾移動城堡 Taitung Arbor white shanties,台灣 臺東市 台東市中正路1號 950,None,景點與地標 景點和地標,site,
TD234, 萬善堂 Wan Shan Tang,台灣 清水區鰲峰里大街路1號 436,None,景點與地標 建築物 景點和地標,site,
TD235, 慈保宮 Ci Bao Gong,台灣 臺東市 台東市中華路2段111巷22弄42號 950,None,景點與地標 建築物 景點和地標,site,
TD236, 大武觀海步道 Tawu Ocean View Forest Trail,台灣 大武鄉 965,None,自然與公園 戶外活動 登山步道,site,
TD237, 池上環圳自行車道 Chihshang Huanzun Bikeway,台灣 池上鄉,None,戶外活動 自然與公園 單車專用道,site,
TD238, 霧鹿溫泉 Wulu Hot Spring,台灣 海端鄉,None,自然與公園 溫泉和間歇泉,site,
TD239, 利嘉林道 Lijia Forest Trail,台灣 臺東市 卑南鄉利嘉林道,None,戶外活動 自然與公園 登山步道,site,
TD240, 金峰溫泉 Jin Fong Hot Spring,台灣 金峰鄉,None,自然與公園 溫泉和間歇泉 自然和野生動物區,site,
TD241, 比魯溫泉 Bi Lu Hot Spring,台灣 金峰鄉嘉蘭村,None,自然與公園 溫泉和間歇泉,site,
TD242, 天龍吊橋 Tian Long Bridge,台灣 海端鄉,None,景點與地標 橋樑,site,
TD243, 紅頭村小漁港 Gongtou Village Fish Harbor,台灣 蘭嶼鄉紅頭村,None,景點與地標 景觀徒步區,site,
TD244, 知本天主堂 Jhih Ben Church,台灣 臺東市 台東市知本路三段331巷15號,None,景點與地標 教堂和大教堂,site,
TD245, 都蘭天主堂 Dulan Church,台灣 東河鄉302號,None,景點與地標 教堂和大教堂,site,
TD246, 池上蠶桑休閒農場 Chihshang Silkworm Leisure Farm,台灣 池上鄉萬安村27號,None,景點與地標 農場,site,
TD247, 娜路彎劇場 Naluwan Theater,台灣 臺東市 台東市連航路66號,None,演唱會和表演 劇場,site,
TD248, 樹屋 Tree House,台灣 臺東市 台東市中山路,None,景點與地標 景點和地標,site,
TD249, 綠島海底公園 Green Island Sea Park,台灣 綠島鄉,None,自然與公園,site,
TD250, 綠島流麻溝 Green Island Liou Ma Gou,台灣 綠島鄉,None,自然與公園 島嶼,site,
TD251, 白守蓮河濱公園 Baishoulian Waterfront Park,台灣 成功鎮三仙台,None,自然與公園,site,
TD252, 海角樂園 Ho Ping Island Hi Park,台灣 長濱鄉忠勇路,None,自然與公園,site,
TD253, 忠勇單車秘徑 Jhongyong Bikeway,台灣 長濱鄉忠勇村,None,戶外活動 自然與公園 單車專用道,site,
TD254, 龍門港 Longmen Port,台灣 蘭嶼鄉龍門港,None,景點與地標 景點和地標,site,
TD255, 長濱海岸觀景台 Changbin Coast Observatory,台灣 臺東市 長濱鄉,None,博物館 觀景台和天文台,site,
TD256, 台灣南島民族展館 Taiwan South Aboriginal Culture House,台灣 臺東市 台東市博物館路1號,None,景點與地標 景點和地標,site,
TD257, 都歷部落  Tulik Clan,台灣 成功鎮信都歷路63-1號,None,景點與地標 景點和地標,site,
TD258, 台灣基督長老教會初鹿教會 Taiwan Presbyterian Chulu Church,台灣 卑南鄉明峰村忠孝路272巷5號,None,景點與地標 教堂和大教堂,site,
TD259, 寶抱鼓 PawPaw,台灣 台11線 961,None,景點與地標 景點和地標,site,
TD260, 人權文化園區 Human Rights Memorial Park,台灣 台東市,None,景點與地標 景點和地標,site,
TD261, 棒球博物館 Hung Yeh Baseball Museum,台灣,None,博物館 特色博物館,site,
